{
  "$schema": "../../schema/game.schema.json",
  "id": "old-maid",
  "deckType": "stripped",
  "decks": 1,
  "name": "הזקנה",
  "aliases": [
    "Old Maid",
    "פטר השחור",
    "Black Peter"
  ],
  "hook": "מוציאים זוגות, שולפים קלף מהשכן, ומקווים לא להישאר עם המלכה. משחק מזל ופרצוף פוקר לכל הגילים.",
  "players": [
    2,
    8
  ],
  "best": "3–6",
  "minutes": [
    5,
    15
  ],
  "difficulty": 1,
  "age": "4+",
  "deck": "חפיסה רגילה בלי Q♣: נשארים 51 קלפים",
  "tags": [
    "kids",
    "family",
    "group",
    "luck",
    "quick"
  ],
  "goal": "להיפטר מכל הקלפים בזוגות. מי שנשאר בסוף עם Q♠, \"הזקנה\", מפסיד.",
  "values": [
    [
      "7S 7C",
      "זוג שחור"
    ],
    [
      "7H 7D",
      "זוג אדום"
    ],
    [
      "QS",
      "הזקנה: אין לה זוג"
    ]
  ],
  "valuesNote": "זוג הוא שני קלפים באותו מספר ובאותו צבע: שני אדומים (♥ ו-♦) או שני שחורים (♠ ו-♣). 9♥ הולך עם 9♦, לא עם 9♠.",
  "setup": {
    "steps": [
      "מוציאים מהחפיסה את Q♣. עכשיו ל-Q♠ אין זוג, כי רק Q♣ באותו צבע.",
      "מחלקים את כל הקלפים. זה בסדר אם לחלק מהשחקנים יש קלף אחד יותר.",
      "כל אחד מוציא מהיד את כל הזוגות שלו ומניח אותם גלויים על השולחן."
    ],
    "visual": {
      "rows": [
        {
          "label": "יוצא מהחפיסה",
          "cards": "QC",
          "note": "כך ל-Q♠ אין זוג"
        },
        {
          "label": "מניחים זוגות",
          "cards": "4D 4H | KS KC",
          "note": "שני 4 אדומים, ושני K שחורים"
        }
      ],
      "caption": "מוציאים את Q♣, מחלקים הכל, וכל שחקן מניח את הזוגות שלו."
    }
  },
  "turn": [
    {
      "t": "פורשים את הקלפים ביד כמו מניפה, עם הגב לשחקן שמשמאלך."
    },
    {
      "t": "הוא שולף מהם קלף אחד בלי לראות.",
      "visual": {
        "rows": [
          {
            "label": "שולף קלף אחד",
            "cards": "X X X* X X",
            "note": "רואה רק את הגב, לא יודע מה זה"
          }
        ]
      }
    },
    {
      "t": "השלים זוג? הוא מניח את הזוג על השולחן. לא? הקלף נשאר אצלו.",
      "visual": {
        "rows": [
          {
            "label": "שלף 9♦ והיה לו 9♥",
            "cards": "9H 9D*",
            "note": "שני אדומים: זוג"
          },
          {
            "label": "לא זוג",
            "cards": "9H 9S",
            "note": "אדום ושחור"
          }
        ]
      }
    },
    {
      "t": "עכשיו הוא מערבב את היד ופורש אותה לשחקן שמשמאלו, וכך הלאה מסביב לשולחן."
    },
    {
      "t": "מי שנגמרים לו הקלפים יוצא בשלום."
    }
  ],
  "scoring": [
    "בסוף כל הזוגות על השולחן, ונשאר רק קלף אחד: Q♠.",
    "מי שמחזיק אותו הוא \"הזקנה\" ומפסיד בסיבוב."
  ],
  "example": [
    "שלושה שחקנים: מאיה, אלון ותמי. אחרי שמוציאים זוגות, למאיה נשארו 5♦, J♠ ו-Q♠.",
    "מאיה פורשת את הקלפים לאלון. הוא שולף 5♦, ויש לו 5♥: שני אדומים, אז הוא מניח זוג.",
    "אלון פורש לתמי, והיא שולפת קלף שלא מתאים לה. היא פורשת למאיה.",
    "כמה סבבים אחר כך תמי כבר יצאה. למאיה נשארו Q♠ ו-J♠, ולאלון רק J♣. אלון שולף מהיד של מאיה ויוצא לו J♠: שני שחורים, זוג! אלון יוצא, ומאיה נשארת עם הזקנה."
  ],
  "tips": [
    "ערבבו את הקלפים ביד לפני שאתם פורשים אותם, כך שאף אחד לא יזכור איפה המלכה.",
    "שמרו על פרצוף רגוע כששולפים לכם את המלכה, או כשהיא כמעט נשלפת.",
    "אפשר להוציא את המלכה קצת למעלה במניפה, כדי לפתות את השולף."
  ],
  "mistakes": [
    "שוכחים להוציא זוגות בהתחלה.",
    "מזווגים קלפים בצבעים שונים, כמו 9♥ עם 9♠. זוג חייב להיות באותו צבע.",
    "מציצים בקלפים של השכן לפני ששולפים."
  ],
  "variants": [
    [
      "ג'וקר",
      "משאירים את כל 52 הקלפים ומוסיפים ג'וקר אחד. מי שנשאר איתו מפסיד."
    ],
    [
      "פטר השחור",
      "מוציאים את J♣, ומי שנשאר עם J♠ מפסיד."
    ],
    [
      "זוג בכל צבע",
      "לילדים קטנים: כל שני קלפים באותו מספר הם זוג, בלי קשר לצבע. מוציאים את Q♣, ונשארות 3 מלכות: המלכה שנשארת בסוף, איזו שתהיה, היא הזקנה."
    ]
  ],
  "drinking": {
    "rules": [
      "כשמישהו מניח זוג A, כל השאר שותים לגימה.",
      "מי שנשאר עם המלכה בסוף שותה 3 לגימות."
    ]
  },
  "video": "איך משחקים הזקנה old maid card game"
}
