{
  "$schema": "../../schema/game.schema.json",
  "deckType": "standard",
  "decks": 1,
  "age": "18+",
  "drinkingGame": true,
  "deck": "חפיסה רגילה, 52 קלפים בלי ג'וקרים, ומשקה לכל שחקן",
  "id": "higher-or-lower",
  "name": "גבוה או נמוך",
  "aliases": [
    "Higher or Lower",
    "High Low",
    "היי לואו"
  ],
  "hook": "הקלף הבא יהיה גבוה או נמוך? כל ניחוש נכון מאריך את השורה, ומי שטועה שותה לפי אורך השורה.",
  "players": [
    2,
    10
  ],
  "best": "3–8",
  "minutes": [
    10,
    20
  ],
  "difficulty": 1,
  "tags": [
    "group",
    "luck",
    "quick"
  ],
  "goal": "לנחש נכון כמה שיותר פעמים ברצף, ולהעביר את התור לפני שהשורה מתארכת מדי.",
  "values": [
    [
      "2C",
      "הכי נמוך"
    ],
    [
      "3H 10D",
      "לפי המספר"
    ],
    [
      "JC QH KS",
      "אחרי 10"
    ],
    [
      "AD",
      "הכי גבוה"
    ]
  ],
  "valuesNote": "הצורה לא משנה. קלף שווה נחשב טעות.",
  "setup": {
    "steps": [
      "מערבבים את החפיסה. אחד השחקנים הוא המחלק.",
      "המחלק הופך קלף אחד ומניח אותו גלוי באמצע: זו תחילת השורה.",
      "מתחיל השחקן שמשמאל למחלק."
    ],
    "visual": {
      "rows": [
        {
          "label": "תחילת השורה",
          "cards": "8H",
          "note": "הקלף הראשון, גלוי"
        }
      ]
    }
  },
  "turn": [
    {
      "t": "השחקן מנחש: הקלף הבא יהיה גבוה או נמוך מהקלף האחרון בשורה."
    },
    {
      "t": "המחלק הופך את הקלף הבא ומניח אותו בסוף השורה.",
      "visual": {
        "rows": [
          {
            "label": "ניחשת נמוך",
            "cards": "8H 3S*",
            "note": "3 נמוך מ-8: צדקת"
          }
        ]
      }
    },
    {
      "t": "צדקת? ממשיכים לנחש. אחרי 3 ניחושים נכונים ברצף, מותר להגיד \"מעביר\", והתור עובר לשחקן הבא עם אותה שורה."
    },
    {
      "t": "טעית? שותים לגימה על כל קלף בשורה, עד 5. השורה מתחילה מחדש מהקלף האחרון, ושוב מנסה אותו שחקן.",
      "visual": {
        "rows": [
          {
            "label": "ניחשת גבוה",
            "cards": "8H 3S 9D 9C*",
            "note": "9 שווה ל-9: טעות. 4 קלפים בשורה: 4 לגימות"
          }
        ]
      }
    }
  ],
  "scoring": [
    "המשחק נגמר כשנגמרת החפיסה.",
    "אין ניקוד במשחק הרגיל. בגרסה בלי שתייה, מי שצבר הכי מעט נקודות מנצח."
  ],
  "example": [
    "מאיה מנחשת \"נמוך\" מ-8♥. יוצא 3♠: צדקה.",
    "היא מנחשת \"גבוה\" מ-3: יוצא 9♦, צדקה. ושוב \"גבוה\" מ-9: יוצא 10♣, צדקה. אחרי 3 ניחושים נכונים היא אומרת \"מעביר\".",
    "התור של עומר, והשורה כבר באורך 4. הוא מנחש \"נמוך\" מ-10 ויוצא Q♥: טעה. עם ה-Q יש בשורה 5 קלפים, אז הוא שותה 5 לגימות. השורה מתחילה מחדש מה-Q."
  ],
  "tips": [
    "קלף קיצוני (2, 3, K, A) נותן ניחוש בטוח: נחשו לכיוון ההפוך.",
    "קלף באמצע (7, 8)? זה הזמן להעביר את התור, אם מותר."
  ],
  "mistakes": [
    "שוכחים שקלף שווה הוא טעות.",
    "מעבירים לפני 3 ניחושים נכונים. צריך 3 ברצף כדי להעביר."
  ],
  "variants": [
    [
      "העברה מוקדמת",
      "מותר להעביר אחרי 2 ניחושים נכונים. קל יותר."
    ],
    [
      "שווה = כולם",
      "קלף שווה: כולם שותים לגימה, חוץ ממי שניחש."
    ]
  ],
  "sober": {
    "rules": [
      "סופרים נקודות במקום לגימות: טעות שווה נקודה על כל קלף בשורה, עד 5.",
      "בסוף החפיסה, מי שיש לו הכי מעט נקודות מנצח."
    ]
  },
  "video": "higher or lower card drinking game"
}
