{
  "$schema": "../../schema/game.schema.json",
  "deckType": "standard",
  "decks": 1,
  "age": "18+",
  "drinkingGame": true,
  "deck": "חפיסה רגילה, 52 קלפים בלי ג'וקרים, ומשקה לכל שחקן",
  "id": "pyramid",
  "name": "פירמידה",
  "aliases": [
    "Pyramid",
    "Pyramid drinking game",
    "פירמידת שתייה"
  ],
  "hook": "הופכים קלפים בפירמידה וטוענים שיש לכם קלף תואם. אולי כן ואולי זה בלוף. מי שמאתגר ויודע לזכור, מנצח.",
  "players": [
    3,
    8
  ],
  "best": "4–6",
  "minutes": [
    20,
    30
  ],
  "difficulty": 2,
  "tags": [
    "group",
    "thinking",
    "luck"
  ],
  "goal": "לחלק כמה שיותר לגימות לאחרים, לתפוס את הבלופים שלהם, ולזכור אילו קלפים יש לך.",
  "inShort": [
    "לכל שחקן 4 קלפים הפוכים. מסתכלים עליהם פעם אחת בהתחלה, וצריך לזכור אותם.",
    "הופכים את קלפי הפירמידה אחד אחד. מי שטוען שיש לו קלף באותו מספר נותן לגימות למישהו.",
    "מי שקיבל יכול להאמין ולשתות, או לאתגר: אם זה היה בלוף, מי שבלף שותה."
  ],
  "glossary": [
    [
      "בלוף",
      "לטעון שיש לך קלף מסוים כשאין לך."
    ],
    [
      "לאתגר",
      "לא להאמין לטענה, ולבקש לראות את הקלף."
    ]
  ],
  "values": [
    [
      "7S 7H",
      "תואם: אותו מספר, בכל צורה"
    ]
  ],
  "valuesNote": "רק המספר חשוב. 7♠ תואם ל-7♥.",
  "setup": {
    "steps": [
      "מניחים 10 קלפים הפוכים בפירמידה: שורה של 4, מעליה 3, מעליה 2, ובראש קלף אחד.",
      "כל שחקן מקבל 4 קלפים, מניח אותם הפוכים לפניו, ומסתכל עליהם פעם אחת. אחר כך אסור להסתכל.",
      "שאר החפיסה מונחת בצד, הפוכה."
    ],
    "visual": {
      "rows": [
        {
          "label": "הפירמידה",
          "cards": "X | X X | X X X | X X X X",
          "note": "10 קלפים: 4, 3, 2 ו-1"
        },
        {
          "label": "לפני כל שחקן",
          "cards": "X X X X",
          "note": "מסתכלים פעם אחת וזוכרים"
        }
      ],
      "caption": "פירמידה של 10 קלפים הפוכים, ו-4 קלפים הפוכים לפני כל שחקן."
    }
  },
  "turn": [
    {
      "t": "הופכים קלף אחד מהפירמידה, מהשורה של 4 ועד הקלף שבראש. כל שורה שווה מספר לגימות: הראשונה 1, השנייה 2, השלישית 3, והראש 4.",
      "visual": {
        "rows": [
          {
            "label": "נהפך בשורה השנייה",
            "cards": "9D*",
            "note": "שווה 2 לגימות"
          }
        ]
      }
    },
    {
      "t": "כל אחד יכול לטעון שיש לו קלף באותו מספר, ולבחור מי ישתה את הלגימות של השורה. מותר לבלף."
    },
    {
      "t": "מי שנבחר מחליט: מאמין ושותה, או אומר \"מאתגר!\"."
    },
    {
      "t": "אתגר: מי שטען הופך את הקלף שלו. היה לו קלף תואם? המאתגר שותה פי 2. בלף? מי שבלף שותה פי 2. בכל מקרה, לא יותר מ-5 לגימות.",
      "visual": {
        "rows": [
          {
            "label": "טען שיש לו 9",
            "cards": "9S*",
            "note": "צדק: המאתגר שותה פי 2"
          },
          {
            "label": "בלף",
            "cards": "4C",
            "note": "אין 9: מי שבלף שותה פי 2"
          }
        ]
      }
    },
    {
      "t": "מי שהראה קלף מחליף אותו בקלף חדש מהחפיסה, מסתכל עליו פעם אחת, ומניח אותו הפוך."
    },
    {
      "t": "אחרי הקלף שבראש: כל שחקן אומר בקול מה 4 הקלפים שלו, והופך אותם. על כל טעות, לגימה."
    }
  ],
  "scoring": [
    "המשחק נגמר אחרי שכולם הפכו את הקלפים שלהם בסוף.",
    "אין ניקוד במשחק הרגיל. בגרסה בלי שתייה, מי שצבר הכי מעט נקודות מנצח."
  ],
  "example": [
    "ארבעה שחקנים: יעל, אבי, שקד ונועם. נהפך 9♦ בשורה השנייה, ששווה 2 לגימות.",
    "אבי אומר: \"יש לי 9, שקד שותה\". שקד לא מאמין: \"מאתגר!\". אבי הופך 9♠: הוא צדק, ושקד שותה 4 לגימות.",
    "אבי לוקח קלף חדש מהחפיסה, מסתכל עליו פעם אחת, ומניח אותו הפוך.",
    "בשורה השלישית נהפך K. נועם טוען שיש לו K ונותן ליעל 3 לגימות. יעל מאתגרת, ונועם הופך 6♣: בלף. נועם שותה 5, כי זה המקסימום."
  ],
  "tips": [
    "בלפו כשהשורה זולה: אם יתפסו אתכם, זה עולה מעט.",
    "שימו לב מי טוען הרבה פעמים: הוא כנראה מבלף.",
    "כדי לזכור את הקלפים, אמרו לעצמכם אותם בשקט בכל סיבוב."
  ],
  "mistakes": [
    "מציצים שוב בקלפים שלכם. מסתכלים רק פעם אחת, וכשמחליפים קלף.",
    "שוכחים להחליף קלף אחרי שהראו אותו, וכולם יודעים מה הוא."
  ],
  "variants": [
    [
      "פירמידה גבוהה",
      "15 קלפים בחמש שורות. רק לקבוצות מנוסות, עם אותה מגבלה של 5 לגימות."
    ],
    [
      "בלי סוף זיכרון",
      "מדלגים על השלב האחרון של אמירת הקלפים."
    ]
  ],
  "sober": {
    "rules": [
      "סופרים נקודות במקום לגימות: מי שהיה שותה מקבל נקודות.",
      "האתגר והבלוף נשארים בדיוק אותו דבר. זה החלק הכי מהנה גם בלי שתייה.",
      "בסוף, מי שיש לו הכי מעט נקודות מנצח."
    ]
  },
  "video": "how to play pyramid drinking card game"
}
