{
  "$schema": "../../schema/game.schema.json",
  "id": "kings-cup",
  "deckType": "standard",
  "decks": 1,
  "age": "18+",
  "drinkingGame": true,
  "deck": "חפיסה רגילה, 52 קלפים בלי ג'וקרים, משקה לכל שחקן, וכוס קטנה וריקה",
  "name": "קינגס קאפ",
  "aliases": [
    "Kings Cup",
    "Ring of Fire",
    "מעגל האש",
    "Circle of Death"
  ],
  "hook": "שולפים קלף מהמעגל ועושים מה שהוא אומר. לכל קלף חוק אחר, ומי ששולף את המלך הרביעי שותה מהכוס שבמרכז.",
  "players": [
    3,
    12
  ],
  "best": "4–8",
  "minutes": [
    20,
    45
  ],
  "difficulty": 1,
  "tags": [
    "group",
    "luck",
    "quick"
  ],
  "goal": "אין מנצח. שולפים קלפים, ממלאים את החוקים, והמשחק נגמר כשנשלף המלך הרביעי.",
  "values": [
    [
      "AS",
      "מפל: כולם מתחילים לשתות יחד. מותר להפסיק רק אחרי שמי שלפניך הפסיק, ומי ששלף מפסיק מתי שהוא רוצה."
    ],
    [
      "2H",
      "אתה: בוחרים מישהו שישתה."
    ],
    [
      "3C",
      "אני: אתה שותה."
    ],
    [
      "4D",
      "רצפה: כולם נוגעים ברצפה. האחרון שותה."
    ],
    [
      "5S",
      "אגודל: מתי שתרצה, הנח אגודל על השולחן בשקט. האחרון שמעתיק שותה. הכוח שלך עד שנשלף 5 הבא."
    ],
    [
      "6H",
      "אף פעם לא: אומרים משהו שלא עשית אף פעם. מי שכן עשה, שותה."
    ],
    [
      "7C",
      "שמיים: כולם מצביעים למעלה. האחרון שותה."
    ],
    [
      "8D",
      "שותף: בוחרים שותף. עד סוף המשחק, בכל פעם שאחד מכם שותה, גם השני שותה."
    ],
    [
      "9S",
      "חרוזים: אומרים מילה, וכל אחד בתורו אומר מילה מתחרזת. מי שנתקע שותה."
    ],
    [
      "10H",
      "קטגוריה: בוחרים נושא (למשל מותגי רכב), וכל אחד בתורו אומר משהו ממנו. מי שנתקע או חוזר על משהו שותה."
    ],
    [
      "JC",
      "חוק: ממציאים חוק עד סוף המשחק, למשל אסור לומר \"כן\". מי שמפר אותו שותה."
    ],
    [
      "QD",
      "מלך השאלות: עד ה-Q הבא, מי שעונה לשאלה שלך שותה."
    ],
    [
      "KS",
      "כוס המלך: שופכים מעט מהמשקה שלך לכוס שבמרכז. מי ששולף את המלך הרביעי שותה אותה."
    ]
  ],
  "valuesNote": "הצורה לא משנה, רק המספר. לכל קבוצה חוקים קצת אחרים, אז כדאי לסכם לפני שמתחילים.",
  "setup": {
    "steps": [
      "מניחים כוס קטנה וריקה במרכז השולחן.",
      "מערבבים את החפיסה ומפזרים את הקלפים הפוכים במעגל סביב הכוס, כך שהם נוגעים זה בזה.",
      "לכל שחקן משקה משלו. מתחיל המחלק, והתור עובר לשמאל."
    ],
    "visual": {
      "rows": [
        {
          "label": "מרכז השולחן",
          "cards": "X X X X X X X X",
          "note": "קלפים הפוכים במעגל סביב כוס ריקה"
        }
      ],
      "caption": "כוס קטנה במרכז, וכל הקלפים הפוכים במעגל סביבה."
    }
  },
  "turn": [
    {
      "t": "בתורך שולפים קלף אחד מהמעגל והופכים אותו, כך שכולם רואים."
    },
    {
      "t": "עושים מה שהקלף אומר, לפי הרשימה בערכי הקלפים.",
      "visual": {
        "rows": [
          {
            "label": "שלפת 4",
            "cards": "4D*",
            "note": "רצפה: כולם נוגעים ברצפה, והאחרון שותה"
          }
        ]
      }
    },
    {
      "t": "משאירים את הקלף גלוי מולך. ה-5 וה-Q נותנים כוח עד שנשלף הקלף הבא מאותו מספר, וכך כולם זוכרים אצל מי הכוח."
    },
    {
      "t": "התור עובר לשחקן שמשמאלך."
    },
    {
      "t": "שלפת מלך? שופכים מעט מהמשקה שלך לכוס שבמרכז. מי ששולף את המלך הרביעי שותה אותה, והמשחק נגמר.",
      "visual": {
        "rows": [
          {
            "label": "4 מלכים",
            "cards": "KH KS KD KC*",
            "note": "המלך הרביעי: שותים את הכוס שבמרכז"
          }
        ]
      }
    }
  ],
  "scoring": [
    "המשחק נגמר כשנשלף המלך הרביעי.",
    "אין מנצח ואין מפסיד. אפשר לערבב ולשחק שוב."
  ],
  "example": [
    "נטע, רועי, ליה ואסף. נטע שולפת 7. כולם מצביעים לשמיים, ורועי האחרון: הוא שותה לגימה.",
    "רועי שולף J וממציא חוק: אסור לומר שמות. ליה אומרת \"נטע, תורך\" ושותה.",
    "ליה שולפת 5. כמה תורות אחר כך היא מניחה אגודל על השולחן בשקט. אסף שם לב אחרון ושותה.",
    "אסף שולף את המלך השלישי ושופך מעט לכוס שבמרכז. מי שישלוף את המלך הבא ישתה אותה."
  ],
  "tips": [
    "שימו בכוס שבמרכז רק מעט מכל משקה. היא נשתית בבת אחת.",
    "סכמו את חוקי הקלפים לפני שמתחילים, ואם צריך, רשמו אותם על דף.",
    "מיץ או מים בכוסות עובדים בדיוק אותו דבר."
  ],
  "mistakes": [
    "משאירים רווחים במעגל ומתווכחים. כדאי שהקלפים ייגעו זה בזה.",
    "שוכחים אצל מי הכוח של ה-5 או ה-Q. השאירו את הקלף גלוי מולכם."
  ],
  "variants": [
    [
      "שבירת המעגל",
      "מי ששולף קלף ופותח רווח במעגל שותה."
    ],
    [
      "5 ו-6 המקוריים",
      "בגרסה הוותיקה, 5 הוא \"בנים שותים\" ו-6 הוא \"בנות שותות\"."
    ],
    [
      "בלי אלכוהול",
      "הכוס שבמרכז מתמלאת במיץ, ובמקום לשתות עושים משימה קטנה."
    ]
  ],
  "video": "how to play kings cup drinking game"
}
