{
  "$schema": "../../schema/game.schema.json",
  "id": "go-fish",
  "deckType": "standard",
  "decks": 1,
  "name": "דג",
  "aliases": [
    "Go Fish",
    "גו פיש",
    "לך לדוג"
  ],
  "hook": "שואלים את החברים \"יש לך 7?\" ואוספים רביעיות. משחק ראשון מצוין לילדים שיודעים לזהות מספרים.",
  "players": [
    2,
    6
  ],
  "best": "3–5",
  "minutes": [
    10,
    20
  ],
  "difficulty": 1,
  "age": "5+",
  "deck": "חפיסה רגילה, 52 קלפים בלי ג'וקרים",
  "tags": [
    "kids",
    "family",
    "group",
    "luck"
  ],
  "goal": "לאסוף כמה שיותר רביעיות: ארבעה קלפים באותו מספר. כשכל הרביעיות נאספו, מי שיש לו הכי הרבה מנצח.",
  "values": [
    [
      "7S 7H 7D 7C",
      "רביעייה"
    ]
  ],
  "valuesNote": "רק המספר חשוב. הצורה לא משנה.",
  "setup": {
    "steps": [
      "מערבבים את 52 הקלפים.",
      "ב-2 או 3 שחקנים כל אחד מקבל 7 קלפים. ב-4 שחקנים ומעלה, 5 קלפים.",
      "את שאר הקלפים מפזרים הפוכים באמצע השולחן: זו \"הבריכה\".",
      "כל אחד מחזיק את הקלפים שלו ביד כך שאחרים לא רואים."
    ],
    "visual": {
      "rows": [
        {
          "label": "כל שחקן (2–3 שחקנים)",
          "cards": "X X X X X X X"
        },
        {
          "label": "הבריכה",
          "cards": "X X X X X",
          "note": "שאר הקלפים, הפוכים ומפוזרים"
        }
      ],
      "caption": "כל שחקן מקבל 7 קלפים (או 5 כשיש 4 שחקנים ומעלה). השאר מפוזרים הפוכים באמצע."
    }
  },
  "turn": [
    {
      "t": "בוחרים שחקן ושואלים אותו על מספר אחד, למשל \"נועה, יש לך 7?\". מותר לשאול רק על מספר שיש לך לפחות קלף אחד שלו.",
      "visual": {
        "rows": [
          {
            "label": "ביד שלך",
            "cards": "7H* 7S* 3D KC",
            "note": "יש לך 7, אז מותר לשאול על 7"
          }
        ]
      }
    },
    {
      "t": "יש לה? היא חייבת לתת לך את כל ה-7 שבידה. קיבלת, אז אתה שואל שוב, את מי שתרצה."
    },
    {
      "t": "אין לה? היא אומרת \"לך לדוג!\" ואתה לוקח קלף אחד מהבריכה. אם יצא בדיוק המספר ששאלת, מראים אותו לכולם ושואלים שוב. אחרת, התור עובר לשחקן ששאלת."
    },
    {
      "t": "השלמת רביעייה? מניחים אותה גלויה מולך. היא כבר לא חלק מהיד.",
      "visual": {
        "rows": [
          {
            "label": "רביעייה על השולחן",
            "cards": "QS QH QD QC"
          }
        ]
      }
    },
    {
      "t": "נגמרו לך הקלפים ביד? לוקחים קלף אחד מהבריכה וממשיכים. אם גם הבריכה ריקה, סיימת לשחק."
    }
  ],
  "scoring": [
    "המשחק נגמר כשכל 13 הרביעיות על השולחן.",
    "מי שאסף הכי הרבה רביעיות מנצח."
  ],
  "example": [
    "שלושה שחקנים: נועה, איתי וליה. לאיתי יש 7♥ 7♠ 3♦ K♣ ועוד קלפים.",
    "איתי שואל: \"ליה, יש לך 7?\". לליה יש 7♦, והיא נותנת לו. עכשיו יש לאיתי שלושה 7, והוא שואל שוב.",
    "\"נועה, יש לך 7?\". לנועה אין: \"לך לדוג!\". איתי לוקח מהבריכה 9♣. זה לא 7, אז התור עובר לנועה.",
    "נועה זוכרת שלאיתי יש 7. כשתמשוך בעצמה 7, היא תדע ממי לבקש את השאר."
  ],
  "tips": [
    "זכרו מי שאל על מה. אם ליה שאלה על 5, יש לה 5.",
    "שאלו קודם על מספר שיש לכם ממנו כמה קלפים.",
    "לילדים קטנים, אפשר לשחק עם הקלפים פתוחים על השולחן בסיבוב הראשון."
  ],
  "mistakes": [
    "שואלים על מספר שאין לכם ביד. אסור.",
    "נותנים רק חלק מהקלפים. מי שנשאל חייב לתת את כל הקלפים באותו מספר.",
    "מראים את הקלף שנלקח מהבריכה כשהוא לא המספר ששאלו."
  ],
  "variants": [
    [
      "זוגות",
      "אוספים זוגות במקום רביעיות. קצר יותר ומתאים לגיל 4."
    ],
    [
      "בלי תור נוסף",
      "גם כשמהבריכה יוצא המספר ששאלתם, התור עובר."
    ],
    [
      "בריכה בערימה",
      "שמים את הבריכה בערימה אחת ולוקחים מלמעלה, כדי שלא יתפזרו קלפים."
    ]
  ],
  "video": "איך משחקים דג קלפים go fish"
}
