{
  "$schema": "../../schema/game.schema.json",
  "id": "durak",
  "deckType": "stripped",
  "decks": 1,
  "name": "דוראק",
  "aliases": [
    "Durak",
    "Дурак"
  ],
  "hook": "תוקפים ומתגוננים, וצורת השליט גוברת על כל השאר. משחק הקלפים הפופולרי ביותר ברוסיה.",
  "players": [
    2,
    6
  ],
  "best": "3–4",
  "minutes": [
    15,
    30
  ],
  "difficulty": 2,
  "age": "10+",
  "deck": "36 קלפים: חפיסה רגילה בלי ה-2, 3, 4 ו-5",
  "tags": [
    "attack",
    "thinking",
    "group",
    "shedding",
    "world"
  ],
  "goal": "להיפטר מכל הקלפים. אין מנצח: מי שנשאר אחרון עם קלפים הוא ה\"דוראק\" (הטיפש).",
  "values": [
    [
      "6S",
      "הכי נמוך"
    ],
    [
      "7H 10D",
      "עולה לפי המספר"
    ],
    [
      "JC QH KS",
      "אחרי 10"
    ],
    [
      "AD",
      "הכי גבוה"
    ]
  ],
  "valuesNote": "כל קלף בצורת השליט גובר על כל קלף מצורה אחרת, גם על A.",
  "setup": {
    "steps": [
      "מוציאים מהחפיסה את כל ה-2, 3, 4 ו-5. נשארים 36 קלפים.",
      "כל שחקן מקבל 6 קלפים.",
      "הופכים את הקלף הבא ומניחים אותו מתחת לקופה, כך שהוא מציץ החוצה. הצורה שלו היא השליט לכל המשחק.",
      "הקלף הגלוי הזה הוא הקלף האחרון שיימשך מהקופה.",
      "מתחיל לתקוף מי שיש לו את קלף השליט הנמוך ביותר."
    ],
    "visual": {
      "rows": [
        {
          "label": "כל שחקן",
          "cards": "X X X X X X"
        },
        {
          "label": "קופה ושליט",
          "cards": "X 9H*",
          "note": "כאן ♥ הוא השליט"
        }
      ],
      "caption": "6 קלפים לכל שחקן. מתחת לקופה קלף גלוי אחד, והצורה שלו היא השליט."
    }
  },
  "turn": [
    {
      "t": "התוקף מניח קלף מול השחקן שאחריו, המגן.",
      "visual": {
        "rows": [
          {
            "label": "התקפה",
            "cards": "8S"
          }
        ]
      }
    },
    {
      "t": "המגן מכסה את הקלף בקלף גבוה יותר מאותה צורה, או בכל קלף שליט.",
      "visual": {
        "rows": [
          {
            "label": "מכסה באותה צורה",
            "cards": "8S QS*",
            "note": "Q♠ גבוה מ-8♠"
          },
          {
            "label": "או בשליט",
            "cards": "8S 6H*",
            "note": "♥ שליט, אז גם 6 נמוך גובר על ♠"
          }
        ]
      }
    },
    {
      "t": "התוקף, וגם שאר השחקנים, יכולים להוסיף עוד קלפי התקפה, אבל רק במספר שכבר נמצא על השולחן. המגן צריך לכסות כל אחד מהם.",
      "visual": {
        "rows": [
          {
            "label": "על השולחן 8 ו-Q",
            "cards": "8S QS | 8D* QC*",
            "note": "מותר להוסיף רק 8 או Q"
          }
        ]
      }
    },
    {
      "t": "בכל סיבוב מותר עד 6 קלפי התקפה, ולא יותר ממספר הקלפים שיש למגן ביד."
    },
    {
      "t": "המגן כיסה הכל? כל הקלפים שעל השולחן יוצאים מהמשחק, והמגן הופך לתוקף הבא."
    },
    {
      "t": "המגן לא יכול או לא רוצה לכסות? הוא לוקח ליד את כל הקלפים שעל השולחן ומפסיד את התור. התוקף הבא הוא השחקן שאחריו."
    },
    {
      "t": "בסוף כל סיבוב, כולם משלימים ל-6 קלפים מהקופה: קודם התוקף, והמגן אחרון."
    }
  ],
  "scoring": [
    "כשהקופה נגמרת, לא משלימים יותר.",
    "מי שנגמרים לו הקלפים יוצא בשלום.",
    "האחרון שנשאר עם קלפים הוא הדוראק, והוא מחלק בסיבוב הבא."
  ],
  "example": [
    "השליט הוא ♥. ליאור תוקף את מיכל עם 7♣. מיכל מכסה ב-10♣.",
    "על השולחן יש עכשיו 7 ו-10, אז ליאור מוסיף 10♦. מיכל מכסה ב-6♥, שליט נמוך.",
    "לאף אחד אין עוד 7 או 10 להוסיף. מיכל הגנה בהצלחה: ארבעת הקלפים יוצאים, ומיכל תוקפת עכשיו.",
    "מיכל תוקפת את רון עם A♠. לרון אין שליט שהוא רוצה לבזבז, אז הוא לוקח את A♠ ליד ומפסיד את התור."
  ],
  "tips": [
    "אל תבזבזו שליטים על קלפים נמוכים כשהקופה עוד מלאה.",
    "תקפו עם קלף שיש לכם עוד אחד כמוהו. כך תוכלו להוסיף אותו מיד.",
    "זכרו אילו קלפים כבר יצאו, במיוחד שליטים ו-A.",
    "בתחילת המשחק, לפעמים כדאי לקחת כמה קלפים נמוכים בכוונה ולשמור את השליטים."
  ],
  "mistakes": [
    "מוסיפים קלף התקפה במספר שלא נמצא על השולחן.",
    "מכסים בקלף גבוה מצורה אחרת. מותר לכסות רק באותה צורה או בשליט.",
    "המגן מושך מהקופה לפני התוקף."
  ],
  "variants": [
    [
      "דוראק מעביר",
      "המגן יכול להניח קלף באותו מספר ולהעביר את כל ההתקפה לשחקן הבא."
    ],
    [
      "זוגות",
      "4 שחקנים, שניים מול שניים, יושבים לסירוגין ועוזרים זה לזה."
    ],
    [
      "סיבוב ראשון קצר",
      "בסיבוב הראשון של המשחק מותרים רק 5 קלפי התקפה."
    ]
  ],
  "drinking": {
    "rules": [
      "מגן שלוקח את הקלפים ליד שותה לגימה.",
      "מגן שכיסה הכל בהצלחה בוחר מישהו שישתה.",
      "הדוראק בסוף המשחק מסיים את הכוס."
    ]
  },
  "video": "how to play durak card game"
}
