{
  "$schema": "../../schema/game.schema.json",
  "deckType": "standard",
  "decks": 1,
  "deck": "חפיסה רגילה, 52 קלפים בלי ג'וקרים",
  "id": "golf",
  "name": "גולף",
  "aliases": [
    "Golf",
    "Six-card Golf",
    "גולף 6 קלפים"
  ],
  "hook": "6 קלפים הפוכים מולך, ומחליפים אותם אחד אחד כדי להגיע לסכום הכי נמוך. כמו בגולף, נמוך מנצח.",
  "players": [
    2,
    6
  ],
  "best": "2–4",
  "minutes": [
    20,
    40
  ],
  "difficulty": 1,
  "age": "7+",
  "tags": [
    "kids",
    "family",
    "points",
    "thinking"
  ],
  "goal": "לסיים עם כמה שפחות נקודות אחרי 9 סיבובים.",
  "glossary": [
    [
      "עמודה",
      "שני קלפים שעומדים זה מעל זה, בשורה העליונה ובתחתונה."
    ],
    [
      "סיבוב (\"גומה\")",
      "סיבוב אחד, עד שלמישהו כל 6 הקלפים גלויים. משחק שלם הוא 9 סיבובים."
    ]
  ],
  "values": [
    [
      "AS",
      "1"
    ],
    [
      "2H 10C",
      "לפי המספר"
    ],
    [
      "JD QS",
      "10"
    ],
    [
      "KH",
      "0"
    ]
  ],
  "valuesNote": "שני קלפים באותו מספר באותה עמודה שווים 0 ביחד.",
  "setup": {
    "steps": [
      "כל שחקן מקבל 6 קלפים ומסדר אותם הפוכים מולו בשתי שורות של 3, בלי להסתכל.",
      "כל אחד הופך 2 קלפים לבחירתו.",
      "שאר החפיסה היא הקופה. הופכים את הקלף העליון לידה: זו ערימת הזריקה.",
      "מתחיל השחקן שמשמאל למחלק, והתור עובר לשמאל."
    ],
    "visual": {
      "rows": [
        {
          "label": "שורה עליונה",
          "cards": "KS X X"
        },
        {
          "label": "שורה תחתונה",
          "cards": "X X 5D",
          "note": "2 קלפים גלויים, 4 הפוכים"
        }
      ],
      "caption": "6 קלפים בשתי שורות של 3. בהתחלה רק 2 גלויים."
    }
  },
  "turn": [
    {
      "t": "לוקחים קלף אחד: מהקופה, או את הקלף העליון בערימת הזריקה."
    },
    {
      "t": "מחליפים אותו באחד מ-6 הקלפים שלך, גלוי או הפוך. את הקלף החדש מניחים גלוי, ואת הקלף שהוצאת זורקים לערימה.",
      "visual": {
        "rows": [
          {
            "label": "החלפה",
            "cards": "2H* | 9C",
            "note": "2♥ נכנס גלוי, 9♣ יוצא לערימה"
          }
        ]
      }
    },
    {
      "t": "לקחת מהקופה ולא רוצה את הקלף? מותר לזרוק אותו מיד לערימה, בלי להחליף."
    },
    {
      "t": "שני קלפים באותו מספר באותה עמודה שווים 0. כדאי לחפש זוגות כאלה.",
      "visual": {
        "rows": [
          {
            "label": "עליון",
            "cards": "5H X X"
          },
          {
            "label": "תחתון",
            "cards": "5C* X X",
            "note": "5 ו-5 באותה עמודה: 0"
          }
        ]
      }
    },
    {
      "t": "כשלמישהו כל 6 הקלפים גלויים, כל השאר משחקים עוד תור אחד, ואז הופכים הכל וסופרים."
    }
  ],
  "scoring": [
    "כל אחד סוכם את 6 הקלפים שלו: A שווה 1, מספרים לפי המספר, J ו-Q שווים 10, ו-K שווה 0. זוג באותה עמודה שווה 0.",
    "משחקים 9 סיבובים וסוכמים. מי שיש לו הכי מעט נקודות מנצח."
  ],
  "scoringVisual": {
    "rows": [
      {
        "label": "עליון",
        "cards": "KS 3D 7H"
      },
      {
        "label": "תחתון",
        "cards": "KC 3S AH",
        "note": "K+K = 0, זוג 3 = 0, 7+1 = 8. סך הכל 8"
      }
    ]
  },
  "example": [
    "מיכל הופכת בהתחלה K♠ ו-5♦. בערימה יש 5♥.",
    "בתור הראשון היא לוקחת את 5♥ ושמה אותו מעל ה-5♦ שלה, באותה עמודה. עכשיו העמודה שווה 0. את הקלף שהוציאה, 9♣, היא זורקת.",
    "בתור הבא היא לוקחת מהקופה Q♦ ולא רוצה אותו: 10 נקודות. היא זורקת אותו מיד.",
    "כמה תורות אחר כך כל הקלפים שלה גלויים, וכל השאר משחקים עוד תור אחד."
  ],
  "tips": [
    "K שווה 0: אל תחליפו אותו.",
    "החליפו קודם קלפים הפוכים בקלפים נמוכים: קלף הפוך יכול להיות גם Q.",
    "אל תמהרו לגלות את כל הקלפים: ברגע שעשיתם את זה, כולם מקבלים רק עוד תור אחד."
  ],
  "mistakes": [
    "חושבים שזוג בשורה, זה ליד זה, שווה 0. רק זוג באותה עמודה, אחד מעל השני.",
    "מחליפים קלף ומשאירים את החדש הפוך. הקלף החדש תמיד גלוי."
  ],
  "variants": [
    [
      "2 שווה מינוס 2",
      "כל 2 מוריד 2 נקודות. אפשר לסיים סיבוב בפחות מ-0."
    ],
    [
      "סיבוב אחד",
      "משחקים סיבוב אחד בלבד במקום 9. מתאים לילדים."
    ]
  ],
  "video": "how to play golf card game 6 card"
}
