{
  "$schema": "../../schema/game.schema.json",
  "id": "ride-the-bus",
  "deckType": "standard",
  "decks": 1,
  "age": "18+",
  "drinkingGame": true,
  "deck": "חפיסה רגילה, 52 קלפים בלי ג'וקרים, ומשקה לכל שחקן",
  "name": "האוטובוס",
  "aliases": [
    "Ride the Bus",
    "רייד דה באס",
    "אדום או שחור"
  ],
  "hook": "מנחשים אדום או שחור, גבוה או נמוך, ומקווים לא להיות זה שנוסע באוטובוס בסוף.",
  "players": [
    2,
    8
  ],
  "best": "3–6",
  "minutes": [
    20,
    40
  ],
  "difficulty": 2,
  "tags": [
    "group",
    "luck"
  ],
  "goal": "לא להיות זה שנוסע באוטובוס בסוף: מי שנשאר עם הכי הרבה קלפים צריך לנחש נכון 4 פעמים ברצף.",
  "inShort": [
    "שלב 1: כל שחקן עונה על 4 שאלות על הקלפים שהוא מקבל. טעות היא לגימה.",
    "שלב 2: הופכים פירמידה של קלפים. מי שמחזיק קלף באותו מספר בוחר מי ישתה.",
    "שלב 3: מי שנשאר עם הכי הרבה קלפים \"נוסע באוטובוס\": מנחש עד שהוא צודק 4 פעמים ברצף."
  ],
  "values": [
    [
      "2C",
      "הכי נמוך"
    ],
    [
      "3H 10D",
      "לפי המספר"
    ],
    [
      "JC QH KS",
      "אחרי 10"
    ],
    [
      "AD",
      "הכי גבוה"
    ]
  ],
  "valuesNote": "בשאלת גבוה או נמוך, קלף שווה נחשב טעות.",
  "setup": {
    "steps": [
      "מערבבים חפיסה אחת. אחד השחקנים הוא המחלק.",
      "לכל שחקן משקה משלו. מתחיל השחקן שמשמאל למחלק."
    ],
    "visual": {
      "rows": [
        {
          "label": "ביד המחלק",
          "cards": "X",
          "note": "החפיסה המעורבבת"
        }
      ]
    }
  },
  "turn": [
    {
      "t": "שלב 1, שאלה ראשונה: המחלק שואל כל שחקן \"אדום או שחור?\", ומניח לפניו קלף גלוי. טעית? לגימה אחת.",
      "visual": {
        "rows": [
          {
            "label": "ניחשת אדום",
            "cards": "9H*",
            "note": "צדקת"
          }
        ]
      }
    },
    {
      "t": "שאלה שנייה: \"גבוה או נמוך מהקלף הראשון שלך?\" טעית? 2 לגימות.",
      "visual": {
        "rows": [
          {
            "label": "ניחשת גבוה מ-9",
            "cards": "9H | QS*",
            "note": "Q גבוה מ-9: צדקת"
          }
        ]
      }
    },
    {
      "t": "שאלה שלישית: \"בין שני הקלפים שלך או מחוץ להם?\" טעית? 3 לגימות.",
      "visual": {
        "rows": [
          {
            "label": "ניחשת בין 9 ל-Q",
            "cards": "9H QS | 4D*",
            "note": "4 מחוץ להם: טעית, 3 לגימות"
          }
        ]
      }
    },
    {
      "t": "שאלה רביעית: \"איזו צורה?\" טעית? 4 לגימות."
    },
    {
      "t": "שלב 2, הפירמידה: המחלק מניח 10 קלפים הפוכים בשורות של 4, 3, 2 ו-1, והופך אותם אחד אחד, מהשורה של 4 עד הקלף שבראש.",
      "visual": {
        "rows": [
          {
            "label": "הפירמידה",
            "cards": "X | X X | X X X | X X X X",
            "note": "מהשורה של 4 ועד הקלף שבראש"
          }
        ]
      }
    },
    {
      "t": "נהפך קלף במספר שיש לך מהשלב הראשון? מניחים את הקלף שלך עליו, ובוחרים מי ישתה: לגימה בשורה הראשונה, 2 בשנייה, 3 בשלישית ו-4 בראש."
    },
    {
      "t": "שלב 3, האוטובוס: מי שנשארו לו הכי הרבה קלפים נוסע. המחלק הופך לו קלפים, והוא עונה שוב על 4 השאלות לפי הסדר. טעה? לגימה, ומתחילים מהשאלה הראשונה."
    }
  ],
  "scoring": [
    "המשחק נגמר כשהנוסע עונה נכון על 4 השאלות ברצף.",
    "אין ניקוד. המטרה היא לא לנסוע באוטובוס."
  ],
  "example": [
    "דנה, עידו ותום. דנה מנחשת \"אדום\" ומקבלת 9♥: צדקה. עידו מנחש \"שחור\" ומקבל 3♦: טעה, לגימה אחת.",
    "בשאלה השנייה דנה מנחשת \"גבוה מ-9\" ומקבלת Q♠: צדקה. בשלישית היא מנחשת \"בין 9 ל-Q\" ומקבלת 4♦: טעתה, 3 לגימות.",
    "בפירמידה נהפך 4 בשורה השנייה. לדנה יש 4♦: היא מניחה אותו ובוחרת שתום ישתה 2 לגימות.",
    "בסוף לתום נשארו הכי הרבה קלפים, והוא נוסע. הוא טועה פעמיים בשאלה השנייה, ובפעם השלישית עונה נכון על כל 4 ברצף."
  ],
  "tips": [
    "שתו לגימות קטנות: יש הרבה טעויות במשחק הזה.",
    "בשאלת בין או מחוץ, כשהקלפים רחוקים (3 ו-K), \"בין\" הוא ניחוש בטוח יותר."
  ],
  "mistakes": [
    "שוכחים שקלף שווה בגבוה או נמוך נחשב טעות.",
    "ממשיכים את האוטובוס מהשאלה שבה טעו. מתחילים תמיד מהשאלה הראשונה."
  ],
  "variants": [
    [
      "אוטובוס קצר",
      "הנוסע צריך לצדוק 3 פעמים ברצף במקום 4."
    ],
    [
      "בלי פירמידה",
      "מדלגים על שלב 2. משחק קצר יותר."
    ]
  ],
  "sober": {
    "rules": [
      "סופרים נקודות במקום לגימות: כל לגימה היא נקודה.",
      "בפירמידה, \"לבחור מי ישתה\" הופך ל\"לתת נקודות לשחקן אחר\".",
      "מי שנוסע באוטובוס מקבל נקודה על כל טעות.",
      "בסוף, מי שיש לו הכי מעט נקודות מנצח."
    ]
  },
  "video": "how to play ride the bus drinking game"
}
