{
  "$schema": "../../schema/game.schema.json",
  "deckType": "standard",
  "decks": 1,
  "deck": "חפיסה רגילה, 52 קלפים בלי ג'וקרים, ואסימונים: גפרורים, ממתקים או חרוזים",
  "id": "texas-holdem",
  "name": "פוקר",
  "aliases": [
    "Texas Hold'em",
    "טקסס הולדם",
    "Poker"
  ],
  "hook": "הגרסה הפופולרית של פוקר: 2 קלפים שלך, 5 משותפים על השולחן, ומי שיש לו את חמשת הקלפים הכי טובים, או מי שמבלף הכי טוב, לוקח את הקופה.",
  "players": [
    2,
    10
  ],
  "best": "4–8",
  "minutes": [
    45,
    90
  ],
  "difficulty": 3,
  "age": "12+",
  "tags": [
    "group",
    "thinking",
    "luck"
  ],
  "goal": "לאסוף אסימונים מהשחקנים האחרים. משחקים על אסימונים, לא על כסף.",
  "inShort": [
    "לכל שחקן 2 קלפים מוסתרים, ובאמצע נפתחים בהדרגה 5 קלפים משותפים.",
    "בין השלבים מהמרים: מי שלא רוצה להמשיך מוותר, ומי שנשאר עד הסוף משווה קלפים.",
    "מנצח מי שמרכיב את היד הכי חזקה מ-5 קלפים, מתוך 2 שלו ו-5 המשותפים. או מי שכולם ויתרו לו."
  ],
  "glossary": [
    [
      "קופה",
      "האסימונים שהומרו באמצע. הזוכה בסיבוב לוקח את כולם."
    ],
    [
      "דילר",
      "מי שמחלק בסיבוב הזה. התפקיד עובר שמאלה בכל סיבוב."
    ],
    [
      "בליינד",
      "הימור חובה לפני שרואים קלפים: השחקן שמשמאל לדילר שם 1 אסימון, והבא אחריו 2. כך תמיד יש משהו בקופה."
    ],
    [
      "לוותר",
      "לזרוק את הקלפים ולצאת מהסיבוב. מפסידים את מה שכבר הומר."
    ],
    [
      "להשוות",
      "לשים כמו ההימור הכי גבוה עד עכשיו."
    ],
    [
      "להעלות",
      "לשים יותר מההימור הכי גבוה, כך שכולם יצטרכו להשוות."
    ],
    [
      "צ'ק",
      "לא להמר ולהעביר את התור. מותר רק אם אף אחד עוד לא המר בשלב הזה."
    ]
  ],
  "setup": {
    "steps": [
      "לכל שחקן 30 אסימונים.",
      "בוחרים דילר. השחקן שמשמאלו שם באמצע 1 אסימון, והבא אחריו 2 אסימונים: אלה הבליינדים.",
      "הדילר מחלק לכל שחקן 2 קלפים הפוכים. כל אחד מסתכל בשלו ומסתיר."
    ],
    "visual": {
      "rows": [
        {
          "label": "ביד שלך",
          "cards": "AH KH",
          "note": "2 קלפים, רק אתה רואה"
        },
        {
          "label": "באמצע",
          "cards": "X X X X X",
          "note": "5 קלפים משותפים ייפתחו בהדרגה"
        }
      ],
      "caption": "לכל שחקן 2 קלפים מוסתרים. באמצע ייפתחו 5 קלפים לכולם."
    }
  },
  "turn": [
    {
      "t": "סבב הימורים ראשון: מתחיל השחקן שאחרי הבליינדים. כל אחד בתורו משווה, מעלה או מוותר."
    },
    {
      "t": "הדילר פותח 3 קלפים משותפים באמצע (\"הפלופ\"). סבב הימורים נוסף, מהשחקן שמשמאל לדילר. עכשיו מותר גם צ'ק.",
      "visual": {
        "rows": [
          {
            "label": "הפלופ",
            "cards": "QH JH 2C X X"
          }
        ]
      }
    },
    {
      "t": "הדילר פותח קלף רביעי (\"הטרן\"), ועוד סבב הימורים."
    },
    {
      "t": "הדילר פותח קלף חמישי (\"הריבר\"), וסבב הימורים אחרון.",
      "visual": {
        "rows": [
          {
            "label": "כל 5 המשותפים",
            "cards": "QH JH 2C 10H 7S"
          }
        ]
      }
    },
    {
      "t": "נשאר רק שחקן אחד, כי כל השאר ויתרו? הוא לוקח את הקופה בלי להראות קלפים."
    },
    {
      "t": "נשארו כמה שחקנים? כולם הופכים את 2 הקלפים שלהם. כל אחד בוחר את 5 הקלפים הכי טובים מתוך 7: 2 שלו ו-5 המשותפים. היד החזקה לוקחת את הקופה.",
      "visual": {
        "rows": [
          {
            "label": "שלך + משותפים",
            "cards": "AH KH | QH JH 10H",
            "note": "A, K, Q, J ו-10 ב-♥: רויאל פלאש, היד הכי חזקה"
          }
        ]
      }
    },
    {
      "t": "תפקיד הדילר עובר לשחקן שמשמאלו, ומתחיל סיבוב חדש."
    }
  ],
  "combos": {
    "title": "דירוג הידיים",
    "note": "מהחזקה לחלשה. אם לשני שחקנים אותה יד, מנצח מי שהקלפים שלו גבוהים יותר.",
    "items": [
      {
        "name": "רויאל פלאש",
        "points": "מקום 1",
        "cards": "AH KH QH JH 10H",
        "text": "A עד 10 באותה צורה."
      },
      {
        "name": "סטרייט פלאש",
        "points": "מקום 2",
        "cards": "9S 8S 7S 6S 5S",
        "text": "5 קלפים ברצף באותה צורה."
      },
      {
        "name": "רביעייה",
        "points": "מקום 3",
        "cards": "QS QH QD QC 4S"
      },
      {
        "name": "פול האוס",
        "points": "מקום 4",
        "cards": "KS KH KD 7C 7H",
        "text": "שלישייה ועוד זוג."
      },
      {
        "name": "פלאש",
        "points": "מקום 5",
        "cards": "AD 10D 8D 5D 2D",
        "text": "5 קלפים באותה צורה, לא ברצף."
      },
      {
        "name": "סטרייט",
        "points": "מקום 6",
        "cards": "9C 8D 7H 6S 5C",
        "text": "5 קלפים ברצף, בכל צורה."
      },
      {
        "name": "שלישייה",
        "points": "מקום 7",
        "cards": "8S 8H 8D KC 3S"
      },
      {
        "name": "שני זוגות",
        "points": "מקום 8",
        "cards": "JS JH 4D 4C AS"
      },
      {
        "name": "זוג",
        "points": "מקום 9",
        "cards": "10S 10H KD 6C 2S"
      },
      {
        "name": "קלף גבוה",
        "points": "מקום 10",
        "cards": "AS JH 8D 5C 3S",
        "text": "אין כלום? הקלף הכי גבוה קובע."
      }
    ]
  },
  "scoring": [
    "שחקן שנגמרו לו האסימונים יוצא מהמשחק.",
    "משחקים עד שלשחקן אחד יש את כל האסימונים, או עד שעה שקבעתם מראש. אז מי שיש לו הכי הרבה מנצח."
  ],
  "example": [
    "ליאור, מאיה ותום. לליאור A♥ K♥. כולם משווים בסבב הראשון.",
    "הפלופ: Q♥ J♥ 2♣. לליאור חסר רק 10♥ לרויאל פלאש. הוא מעלה ב-4 אסימונים. מאיה משווה, ותום מוותר.",
    "הטרן: 10♥! לליאור יש רויאל פלאש. הוא מהמר רק 2 כדי לא להפחיד את מאיה, והיא משווה.",
    "הריבר: 7♠. מאיה הופכת Q♠ Q♦: שלישייה של Q. ליאור הופך A♥ K♥: רויאל פלאש. ליאור לוקח את הקופה."
  ],
  "tips": [
    "בהתחלה, שחקו רק עם קלפים טובים: זוג, או שני קלפים גבוהים. על השאר ויתרו.",
    "שימו לב למקום שלכם: מי שמדבר אחרון יודע יותר, ויכול להרשות לעצמו יותר.",
    "לבלף מותר, אבל לא כל הזמן. כשמבלפים הרבה, מפסיקים להאמין לכם."
  ],
  "mistakes": [
    "חושבים שחייבים להשתמש בשני הקלפים שלך. בוחרים את 5 הכי טובים מתוך 7, גם אם רק אחד או אף אחד מהם שלך.",
    "חושבים שפלאש חזק פחות מסטרייט. פלאש חזק יותר.",
    "שוכחים לשים את הבליינדים לפני החלוקה."
  ],
  "variants": [
    [
      "בליינדים עולים",
      "כל 20 דקות מכפילים את הבליינדים, כדי שהמשחק יסתיים."
    ],
    [
      "פוקר 5 קלפים",
      "בלי קלפים משותפים: כל אחד מקבל 5, ומותר להחליף עד 3 פעם אחת."
    ]
  ],
  "video": "איך משחקים פוקר טקסס הולדם"
}
