{
  "$schema": "../../schema/game.schema.json",
  "id": "perfect-10",
  "deckType": "stripped",
  "decks": [
    1,
    2
  ],
  "name": "בול 10 בקלפים",
  "aliases": [
    "Perfect 10",
    "בול 10"
  ],
  "hook": "מוסיפים קלף לערימה ואומרים את הסכום בקול. מי שמגיע בדיוק ל-10 לוקח את הערימה, ומי שעובר את 10 נותן אותה לשחקן שלפניו.",
  "players": [
    2,
    8
  ],
  "best": "3–5",
  "minutes": [
    10,
    20
  ],
  "difficulty": 1,
  "age": "5+",
  "deck": "חפיסה רגילה בלי ה-J וה-Q: נשארים 44 קלפים. ב-6 שחקנים ומעלה מערבבים 2 חפיסות כאלה.",
  "tags": [
    "kids",
    "family",
    "points",
    "group"
  ],
  "goal": "לאסוף כמה שיותר קלפים. מי שאסף הכי הרבה בסוף מנצח.",
  "values": [
    [
      "AS",
      "1"
    ],
    [
      "2H 9D",
      "לפי המספר"
    ],
    [
      "10C",
      "10"
    ],
    [
      "KH",
      "0: לא מוסיף כלום"
    ]
  ],
  "valuesNote": "הצורה לא משנה. K שווה 0, וזה הופך אותו לקלף שימושי מאוד.",
  "setup": {
    "steps": [
      "מוציאים מהחפיסה את כל ה-J וה-Q.",
      "כל שחקן מקבל 3 קלפים ביד.",
      "שאר הקלפים הם הקופה, הפוכה באמצע. ליד הקופה יש מקום לערימה.",
      "מתחיל השחקן הצעיר, והתור עובר לשמאל."
    ],
    "visual": {
      "rows": [
        {
          "label": "ביד שלך",
          "cards": "4H 7S KD",
          "note": "3 קלפים"
        },
        {
          "label": "באמצע",
          "cards": "X",
          "note": "הקופה. הערימה מתחילה ריקה"
        }
      ],
      "caption": "לכל שחקן 3 קלפים. באמצע: קופה, ומקום לערימה."
    }
  },
  "turn": [
    {
      "t": "בתורך מניחים קלף אחד מהיד על הערימה, ואומרים בקול את הסכום החדש של הערימה."
    },
    {
      "t": "לוקחים קלף מהקופה, כך שתמיד יש ביד 3 קלפים."
    },
    {
      "t": "הסכום בדיוק 10? אתה לוקח את כל הערימה ושם אותה לפניך.",
      "visual": {
        "rows": [
          {
            "label": "הערימה",
            "cards": "4H 2C 4D*",
            "note": "4 + 2 + 4 = 10: בול! לוקחים את הערימה"
          }
        ]
      }
    },
    {
      "t": "הסכום עבר את 10? השחקן שלפניך, זה שהניח את הקלף הקודם, לוקח את הערימה.",
      "visual": {
        "rows": [
          {
            "label": "הערימה",
            "cards": "4H 3C 6D*",
            "note": "4 + 3 + 6 = 13: הערימה הולכת לשחקן הקודם"
          }
        ]
      }
    },
    {
      "t": "אחרי שמישהו לקח ערימה, השחקן הבא מתחיל ערימה חדשה מ-0."
    }
  ],
  "scoring": [
    "כשהקופה נגמרת ממשיכים לשחק עד שהקלפים ביד נגמרים.",
    "כל אחד סופר את הקלפים שלקח. מי שאסף הכי הרבה מנצח."
  ],
  "example": [
    "נועה, אורי וטל. נועה מניחה 4♥ ואומרת \"4\". אורי מניח 2♣: \"6\".",
    "לטל יש 4♦, 7♠ ו-9♥. היא מניחה 4♦: \"10, בול!\" ולוקחת את שלושת הקלפים, ומשלימה מהקופה 6♣.",
    "נועה מתחילה ערימה חדשה עם 8♥. לאורי יש רק קלפים גבוהים, אז הוא מניח K♣: \"8\", בלי להוסיף כלום.",
    "לטל יש 7♠, 9♥ ו-6♣, וכולם מעבירים את 10. היא מניחה 7♠: \"15\". עברה את 10, ולכן אורי, שהניח לפניה, לוקח את הערימה."
  ],
  "tips": [
    "שמרו את ה-K לרגע שכל קלף אחר יעביר את הערימה מעל 10.",
    "חשבו מה השחקן הבא צריך: אם הסכום 8, אל תשאירו לו פתח ל-2.",
    "אם הסכום כבר גבוה ואין לכם קלף טוב, הניחו קלף שיעביר את 10 דווקא כשהשחקן הקודם לא אתם."
  ],
  "mistakes": [
    "לא אומרים את הסכום בקול. זה חלק מהמשחק, וזה מה שהופך אותו לתרגיל חשבון.",
    "שוכחים מי הניח לפניכם. כשעוברים את 10, הערימה הולכת אליו."
  ],
  "variants": [
    [
      "בול 20",
      "משחקים עד 20 במקום 10. ל-Q מחזירים את הערך 10, והסכומים גדלים."
    ],
    [
      "גם חיסור",
      "Q מוריד 5 מהסכום, אבל לא מתחת ל-0. מתאים לילדים שכבר מכירים חיסור."
    ]
  ],
  "video": "בול 10 משחק קלפים"
}
