{
  "$schema": "../../schema/game.schema.json",
  "deckType": "standard",
  "decks": 1,
  "deck": "חפיסה רגילה, 52 קלפים בלי ג'וקרים",
  "id": "cheat",
  "name": "שקרן",
  "aliases": [
    "Cheat",
    "I Doubt It",
    "BS",
    "בלוף"
  ],
  "hook": "מניחים קלפים הפוכים ומכריזים מה הם. אולי זו האמת ואולי שקר. מי שנתפס לוקח את כל הערימה.",
  "players": [
    3,
    10
  ],
  "best": "4–6",
  "minutes": [
    15,
    30
  ],
  "difficulty": 1,
  "age": "8+",
  "tags": [
    "group",
    "shedding",
    "thinking",
    "family"
  ],
  "goal": "להיפטר ראשון מכל הקלפים שלך.",
  "values": [
    [
      "AS",
      "ראשון בסדר"
    ],
    [
      "2H 3D 10C",
      "אחריו לפי המספר"
    ],
    [
      "JS QH KD",
      "אחרי 10, ואחרי K חוזרים ל-A"
    ]
  ],
  "valuesNote": "הצורה לא משנה. בכל תור מכריזים על המספר הבא בסדר.",
  "setup": {
    "steps": [
      "מחלקים את כל הקלפים. זה בסדר אם לחלק מהשחקנים יש קלף אחד יותר.",
      "כל אחד מסתכל בקלפים שלו ומסתיר אותם.",
      "מתחיל השחקן שמשמאל למחלק, והתור עובר לשמאל."
    ],
    "visual": {
      "rows": [
        {
          "label": "כל שחקן (4 שחקנים)",
          "cards": "X X X X X X X X X X X X X",
          "note": "13 קלפים"
        }
      ]
    }
  },
  "turn": [
    {
      "t": "השחקן הראשון מניח באמצע 1 עד 4 קלפים הפוכים, ומכריז: \"שני A\". השחקן הבא מכריז על 2, הבא על 3, וכך הלאה עד K, ואז שוב A."
    },
    {
      "t": "מותר לשקר: להניח קלפים אחרים, או יותר קלפים ממה שיש לך מהמספר הזה. חייבים להניח לפחות קלף אחד.",
      "visual": {
        "rows": [
          {
            "label": "הכריז \"שני 7\" והניח",
            "cards": "7H 7C",
            "note": "אמת"
          },
          {
            "label": "הכריז \"שני 7\" והניח",
            "cards": "7H 4S*",
            "note": "שקר: ה-4 לא 7"
          }
        ]
      }
    },
    {
      "t": "אחרי כל הנחה, כל שחקן יכול לצעוק \"שקרן!\"."
    },
    {
      "t": "צעקו \"שקרן\"? הופכים את הקלפים שהונחו עכשיו. היה שקר? מי שהניח לוקח את כל הערימה. הייתה אמת? מי שצעק לוקח את כל הערימה."
    },
    {
      "t": "אף אחד לא צעק? הקלפים נשארים בערימה, והתור עובר לשחקן הבא, עם המספר הבא."
    }
  ],
  "scoring": [
    "מי שנפטר ראשון מכל הקלפים מנצח. צריך שגם ההנחה האחרונה שלו תעבור בלי שיתפסו אותו בשקר.",
    "אפשר להמשיך לשחק עד שנשאר שחקן אחד, כדי לדעת מי במקום השני והשלישי."
  ],
  "example": [
    "ארבעה שחקנים. דן מניח שני קלפים ומכריז \"שני A\". יש לו באמת A♠ ו-A♦.",
    "רוני צריכה להכריז על 2, אבל אין לה. היא מניחה 9♣ ומכריזה \"2 אחד\".",
    "גלי מחזיקה שלושה 2, אז היא יודעת שזה לא סביר, וצועקת \"שקרן!\". הופכים: 9♣. רוני לוקחת את כל הערימה.",
    "גלי ממשיכה, ומכריזה \"שלושה 3\" על שלושה קלפים שבאמת הם 3."
  ],
  "tips": [
    "זכרו מה יש לכם: אם יש לכם שלושה 8 ומישהו מכריז \"שני 8\", הוא כמעט בטוח משקר.",
    "שקרו כשהערימה קטנה: אם יתפסו אתכם, זה עולה מעט.",
    "בסוף המשחק, כשנשארים לכם מעט קלפים, כולם יחשדו בכם. נסו לשמור את האמת לסוף."
  ],
  "mistakes": [
    "מכריזים על מספר אחר ממה שהגיע התור. בכל תור המספר הבא בסדר.",
    "הופכים את כל הערימה כשצועקים \"שקרן\". הופכים רק את הקלפים שהונחו עכשיו."
  ],
  "variants": [
    [
      "מספר חופשי",
      "כל שחקן מכריז על המספר הקודם, על אותו מספר או על הבא. קשה יותר לתפוס שקר."
    ],
    [
      "שתי חפיסות",
      "ל-7 שחקנים ומעלה מערבבים שתי חפיסות, ומותר להניח עד 8 קלפים."
    ]
  ],
  "drinking": {
    "rules": [
      "מי שלוקח את הערימה שותה לגימה על כל 5 קלפים בה, עד 5.",
      "מי שמנצח בוחר מי ישתה 3 לגימות."
    ]
  },
  "video": "איך משחקים שקרן קלפים"
}
