{
  "$schema": "../../schema/game.schema.json",
  "id": "war",
  "deckType": "standard",
  "decks": 1,
  "name": "מלחמה",
  "aliases": [
    "War"
  ],
  "hook": "הופכים קלף, והגבוה לוקח. משחק הקלפים הראשון שכל ילד לומד.",
  "players": [
    2,
    4
  ],
  "best": "2",
  "minutes": [
    10,
    30
  ],
  "difficulty": 1,
  "age": "4+",
  "deck": "חפיסה רגילה, 52 קלפים בלי ג'וקרים",
  "tags": [
    "kids",
    "family",
    "two",
    "luck"
  ],
  "goal": "לאסוף את כל הקלפים בחפיסה.",
  "values": [
    [
      "2S",
      "הכי נמוך"
    ],
    [
      "3H 10D",
      "עולה לפי המספר"
    ],
    [
      "JC QH KS",
      "אחרי 10"
    ],
    [
      "AD",
      "הכי גבוה"
    ]
  ],
  "valuesNote": "הצורה לא משנה. רק המספר קובע.",
  "setup": {
    "steps": [
      "מערבבים את 52 הקלפים.",
      "מחלקים את כל החפיסה: 26 קלפים לכל שחקן.",
      "כל שחקן מחזיק את הקלפים שלו בערימה הפוכה, ולא מסתכל עליהם."
    ],
    "visual": {
      "rows": [
        {
          "label": "כל שחקן",
          "cards": "X X X",
          "note": "ערימה של 26 קלפים, הפוכה"
        }
      ],
      "caption": "כל שחקן מקבל חצי חפיסה בערימה הפוכה."
    }
  },
  "turn": [
    {
      "t": "שני השחקנים הופכים יחד את הקלף העליון שלהם.",
      "visual": {
        "rows": [
          {
            "label": "אחת, שתיים, שלוש!",
            "cards": "9S | 4H",
            "note": "9 גבוה מ-4"
          }
        ]
      }
    },
    {
      "t": "מי שהקלף שלו גבוה יותר לוקח את שני הקלפים ומכניס אותם לתחתית הערימה שלו."
    },
    {
      "t": "שוויון? \"מלחמה!\" כל אחד מניח 3 קלפים הפוכים ועוד אחד גלוי. הגלוי הגבוה לוקח את כל הקלפים שבאמצע.",
      "visual": {
        "rows": [
          {
            "label": "שוויון",
            "cards": "QS | QD"
          },
          {
            "label": "מלחמה",
            "cards": "X X X 7C | X X X JH*",
            "note": "J גבוה מ-7: בעל ה-J לוקח את כל 10 הקלפים"
          }
        ]
      }
    },
    {
      "t": "שוב שוויון? עושים עוד מלחמה באותה דרך."
    }
  ],
  "scoring": [
    "מי שאוסף את כל הקלפים מנצח.",
    "מי שנגמרים לו הקלפים באמצע מלחמה מפסיד.",
    "המשחק ארוך מדי? קובעים זמן, למשל 10 דקות, ובסוף סופרים: מי שיש לו יותר קלפים מנצח."
  ],
  "example": [
    "נועה ואורי. נועה הופכת 8♦, אורי הופך 3♣. נועה לוקחת את שני הקלפים לתחתית הערימה שלה.",
    "בסיבוב הבא שניהם הופכים K. מלחמה! כל אחד מניח 3 קלפים הפוכים ואחד גלוי: לנועה 5♥, לאורי 10♠.",
    "10 גבוה מ-5, אז אורי לוקח את כל 10 הקלפים שבאמצע."
  ],
  "tips": [
    "אין כאן החלטות, וזה מה שמתאים לילדים קטנים: המשחק מלמד להשוות מספרים.",
    "כדאי להגיד יחד \"אחת, שתיים, שלוש\" לפני שהופכים, כדי שאף אחד לא יציץ.",
    "לגרסה קצרה, מחלקים רק חצי חפיסה."
  ],
  "mistakes": [
    "מסתכלים על הקלף לפני שהופכים. הקלף נשאר סוד עד הרגע שהופכים.",
    "שוכחים ש-A הוא הקלף הכי גבוה."
  ],
  "variants": [
    [
      "3 או 4 שחקנים",
      "מחלקים את כל החפיסה בין כולם. הקלף הגבוה לוקח את כל הקלפים שהתהפכו."
    ],
    [
      "מלחמה מהירה",
      "במלחמה מניחים רק קלף הפוך אחד במקום 3."
    ],
    [
      "מלחמת חיבור",
      "כל אחד הופך 2 קלפים, והסכום הגבוה לוקח. טוב לילדים שלומדים חשבון."
    ]
  ],
  "video": "איך משחקים מלחמה קלפים"
}
