{
  "$schema": "../../schema/game.schema.json",
  "id": "spoons",
  "deckType": "standard",
  "decks": [
    1,
    null
  ],
  "name": "כפיות",
  "aliases": [
    "Spoons",
    "Pig",
    "עטים",
    "פקקים"
  ],
  "hook": "מעבירים קלפים מסביב לשולחן ומחפשים רביעייה. מי שמשיג אחת לוקח בשקט חפץ מהמרכז, וכולם מסתערים. תמיד חסר חפץ אחד.",
  "players": [
    3,
    20
  ],
  "best": "4–10",
  "minutes": [
    10,
    20
  ],
  "difficulty": 1,
  "age": "7+",
  "deck": "חפיסה רגילה בלי ג'וקרים, ועוד חפצים קטנים: כפיות, עטים, פקקים או כל דבר אחר, אחד פחות ממספר השחקנים. בקבוצה גדולה מוסיפים חפיסות.",
  "tags": [
    "family",
    "group",
    "quick",
    "kids"
  ],
  "goal": "לא להישאר בלי חפץ. מי שנשאר בלי מפסיד בסיבוב, והאחרון שנשאר במשחק מנצח.",
  "values": [
    [
      "3S 3H 3D 3C",
      "רביעייה"
    ]
  ],
  "valuesNote": "רק המספר חשוב. הצורה לא משנה.",
  "setup": {
    "steps": [
      "יושבים במעגל סביב שולחן.",
      "מניחים במרכז חפצים קטנים, אחד פחות ממספר השחקנים. המקור הוא כפיות, אבל כל דבר מתאים: עטים, פקקים, ממתקים. ב-6 שחקנים שמים 5.",
      "חפיסה אחת מספיקה עד 10 שחקנים בערך. בקבוצה גדולה יותר מערבבים יחד 2 חפיסות או יותר.",
      "כל שחקן מקבל 4 קלפים. המחלק מחזיק את שאר הקלפים הפוכים לידו: זו הקופה."
    ],
    "visual": {
      "rows": [
        {
          "label": "כל שחקן",
          "cards": "X X X X",
          "note": "4 קלפים ביד"
        },
        {
          "label": "ליד המחלק",
          "cards": "X",
          "note": "הקופה, ובאמצע החפצים"
        }
      ],
      "caption": "4 קלפים לכל שחקן, קופה ליד המחלק, ובמרכז חפצים: אחד פחות ממספר השחקנים."
    }
  },
  "turn": [
    {
      "t": "המחלק לוקח קלף מהקופה. עכשיו יש לו 5, והוא מעביר קלף אחד הפוך לשחקן משמאלו. כך תמיד חוזרים ל-4 ביד."
    },
    {
      "t": "כל שחקן לוקח את הקלף שקיבל, ומעביר קלף אחד לשחקן הבא. השחקן האחרון במעגל מניח את הקלף שלו בערימה ליד המחלק.",
      "visual": {
        "rows": [
          {
            "label": "ביד, וקלף שהגיע",
            "cards": "3S 3H 9D 3D | 3C*",
            "note": "שומרים את 3♣ ומעבירים את 9♦ הלאה"
          }
        ]
      }
    },
    {
      "t": "אין תורות. ממשיכים מהר ככל האפשר, וכולם מעבירים באותו זמן."
    },
    {
      "t": "נגמרה הקופה? המחלק לוקח את הערימה שהצטברה לידו, מערבב, וממשיך."
    },
    {
      "t": "השלמת רביעייה? לוקחים חפץ מהמרכז, בשקט ובלי להודיע.",
      "visual": {
        "rows": [
          {
            "label": "רביעייה",
            "cards": "3S 3H 3D 3C"
          }
        ]
      }
    },
    {
      "t": "ראית שמישהו לקח חפץ? מיד תופסים גם אתה אחד, גם אם אין לך רביעייה."
    }
  ],
  "scoring": [
    "מי שנשאר בלי חפץ מפסיד בסיבוב.",
    "המפסיד יוצא מהמשחק, ומוציאים חפץ אחד מהמרכז.",
    "ממשיכים עד שנשארים שני שחקנים וחפץ אחד. מי שתופס אותו מנצח."
  ],
  "example": [
    "חמישה שחקנים, ובמרכז 4 כפיות. לעומר יש 3♠ 3♥ 9♦ 3♦.",
    "מגיע אליו 3♣. הוא שומר אותו, מעביר את 9♦ לשחקנית הבאה, ובשקט לוקח כפית.",
    "רק הדס שמה לב ותופסת כפית. שאר השחקנים ממשיכים להעביר קלפים בלי לראות.",
    "פתאום כולם רואים ומסתערים. נועם ויובל תופסים את שתי הכפיות האחרונות. עידו נשאר בלי כפית ויוצא, ובסיבוב הבא יהיו 3 כפיות."
  ],
  "tips": [
    "הסתכלו כל הזמן גם על החפצים שבמרכז, לא רק על הקלפים.",
    "החליטו מוקדם איזה מספר אתם אוספים, ואל תחליפו בלי סיבה.",
    "כשיש לכם רביעייה, קחו את החפץ לאט ובלי תנועה גדולה. ככה עוד שחקנים לא ישימו לב.",
    "בחרו חפצים רכים ולא שבירים. כולם יסתערו עליהם יחד."
  ],
  "mistakes": [
    "מחזיקים 5 קלפים יותר מרגע. כל קלף שנכנס, קלף אחר יוצא.",
    "לוקחים חפץ בלי רביעייה כשאף אחד עוד לא לקח. מותר רק אחרי שמישהו כבר לקח.",
    "מסתערים בכוח. משחקים בעדינות, במיוחד עם ילדים."
  ],
  "variants": [
    [
      "S-P-O-O-N",
      "המפסיד לא יוצא מיד, אלא מקבל אות. מי שמשלים את המילה SPOON יוצא."
    ],
    [
      "חזיר",
      "בלי חפצים בכלל: מי שמשלים רביעייה מניח אצבע על האף, וכולם מעתיקים. האחרון מפסיד."
    ],
    [
      "חפצים רחוקים",
      "מניחים את החפצים בחדר אחר. מי שמשלים רביעייה רץ אליהם."
    ]
  ],
  "video": "איך משחקים כפיות קלפים"
}
